{
    "rule_id":  "RULE-EPAZAR-2022-003",
    "source_file":  "Ð£Ð¿Ð°Ñ‚ÑÑ‚Ð²Ð°/ÐšÐ¾Ñ€Ð¸ÑÐ½Ð¸Ñ‡ÐºÐ¾-ÑƒÐ¿Ð°Ñ‚ÑÑ‚Ð²Ð¾-Ð·Ð°-Ð•ÐºÐ¾Ð½Ð¾Ð¼ÑÐºÐ¸-Ð¾Ð¿ÐµÑ€Ð°Ñ‚Ð¾Ñ€Ð¸-ÐµÐŸÐ°Ð·Ð°Ñ€.pdf",
    "source_section":  "Draft citation: pages 14, 20, 22 (support contact and corrective step guidance candidate)",
    "source_page":  14,
    "effective_from":  "2022-02-21",
    "effective_to":  null,
    "rule_type":  "workflow_gate",
    "severity":  "low",
    "condition":  "Requirement REQ-EPAZAR-2022-003 applies to ux_errors flow.",
    "action":  "App must provide corrective guidance for failed steps and keep retry-safe state.",
    "error_message":  "REQ-EPAZAR-2022-003 is not satisfied.",
    "app_module":  "ux_errors",
    "test_case_id":  "TC-REQ-009",
    "approval_state":  "approved",
    "approved_by":  "SME+Legal Wave2",
    "approved_at":  "2026-02-20T00:00:00Z",
    "version":  "0.1.0",
    "notes":  "Promoted to approved after recorded SME and legal sign-off on 2026-02-20 (Wave 2)."
}
