{
    "rule_id":  "RULE-ESJN-2021-004",
    "source_file":  "Ð£Ð¿Ð°Ñ‚ÑÑ‚Ð²Ð°/Priracnik-za-koristenje-na-ESJN-za-Ekonomski-operatori-nov2021.pdf",
    "source_section":  "Draft citation: pages 69, 5, 8 (keyword hits: Ð¿Ð¾Ð½ÑƒÐ´Ð°, Ð¿Ð¾Ð´Ð½ÐµÑ, ÑƒÑÐ»Ð¾Ð²)",
    "source_page":  69,
    "effective_from":  "2021-01-18",
    "effective_to":  null,
    "rule_type":  "document_requirement",
    "severity":  "high",
    "condition":  "Requirement REQ-ESJN-2021-004 applies to doc_builder flow.",
    "action":  "Document builder must enforce required fields before generating final submission pack.",
    "error_message":  "REQ-ESJN-2021-004 is not satisfied.",
    "app_module":  "doc_builder",
    "test_case_id":  "TC-REQ-004",
    "approval_state":  "approved",
    "approved_by":  "SME+Legal Wave1",
    "approved_at":  "2026-02-20T00:00:00Z",
    "version":  "0.1.0",
    "notes":  "Promoted to approved after recorded SME and legal sign-off on 2026-02-20 (Wave 1)."
}
