{
    "rule_id":  "RULE-EPAZAR-2022-002",
    "source_file":  "Ð£Ð¿Ð°Ñ‚ÑÑ‚Ð²Ð°/ÐšÐ¾Ñ€Ð¸ÑÐ½Ð¸Ñ‡ÐºÐ¾-ÑƒÐ¿Ð°Ñ‚ÑÑ‚Ð²Ð¾-Ð·Ð°-Ð•ÐºÐ¾Ð½Ð¾Ð¼ÑÐºÐ¸-Ð¾Ð¿ÐµÑ€Ð°Ñ‚Ð¾Ñ€Ð¸-ÐµÐŸÐ°Ð·Ð°Ñ€.pdf",
    "source_section":  "Draft citation: pages 17, 15, 18 (keyword hits: Ð·Ð°Ð´Ð¾Ð»Ð¶, Ð¿Ð¾Ð»Ð¸ÑšÐ°, Ð²Ð½ÐµÑ)",
    "source_page":  17,
    "effective_from":  "2022-02-21",
    "effective_to":  null,
    "rule_type":  "validation",
    "severity":  "medium",
    "condition":  "Requirement REQ-EPAZAR-2022-002 applies to validation_engine flow.",
    "action":  "For ePazar, app must validate mandatory input set before action execution.",
    "error_message":  "REQ-EPAZAR-2022-002 is not satisfied.",
    "app_module":  "validation_engine",
    "test_case_id":  "TC-REQ-008",
    "approval_state":  "approved",
    "approved_by":  "SME+Legal Wave2",
    "approved_at":  "2026-02-20T00:00:00Z",
    "version":  "0.1.0",
    "notes":  "Promoted to approved after recorded SME and legal sign-off on 2026-02-20 (Wave 2)."
}
