{
  "rule_id": "RULE-ESJN-2021-001",
  "source_file": "Упатства/Priracnik-za-koristenje-na-ESJN-za-Dogovorni-organi-nov2021.pdf",
  "source_section": "Draft citation: pages 41, 174, 6 (keyword hits: пребар, оглас, досие)",
  "source_page": 41,
  "effective_from": "2021-01-08",
  "effective_to": null,
  "rule_type": "workflow_gate",
  "severity": "low",
  "condition": "Requirement REQ-ESJN-2021-001 applies to search flow.",
  "action": "App must support searching notices and opening dossier-level details.",
  "error_message": "REQ-ESJN-2021-001 is not satisfied.",
  "app_module": "search",
  "test_case_id": "TC-REQ-001",
  "approval_state": "draft",
  "approved_by": null,
  "approved_at": null,
  "version": "0.1.0",
  "notes": "Draft rule generated from machine-derived citation matrix. Requires SME + legal validation before any promotion."
}
