{
    "rule_id":  "RULE-EPAZAR-2022-001",
    "source_file":  "Ð£Ð¿Ð°Ñ‚ÑÑ‚Ð²Ð°/ÐšÐ¾Ñ€Ð¸ÑÐ½Ð¸Ñ‡ÐºÐ¾-ÑƒÐ¿Ð°Ñ‚ÑÑ‚Ð²Ð¾-Ð·Ð°-Ð•ÐºÐ¾Ð½Ð¾Ð¼ÑÐºÐ¸-Ð¾Ð¿ÐµÑ€Ð°Ñ‚Ð¾Ñ€Ð¸-ÐµÐŸÐ°Ð·Ð°Ñ€.pdf",
    "source_section":  "Draft citation: pages 7, 11, 13 (keyword hits: ÐµÐ¿Ð°Ð·Ð°Ñ€, Ð¾Ð¿ÐµÑ€Ð°Ñ‚Ð¾Ñ€, ÐºÐ°Ñ‚Ð°Ð»Ð¾Ð³)",
    "source_page":  7,
    "effective_from":  "2022-02-21",
    "effective_to":  null,
    "rule_type":  "workflow_gate",
    "severity":  "medium",
    "condition":  "Requirement REQ-EPAZAR-2022-001 applies to workflow_router flow.",
    "action":  "App must distinguish ePazar-specific process from ESJN tender flow in UX and validation logic.",
    "error_message":  "REQ-EPAZAR-2022-001 is not satisfied.",
    "app_module":  "workflow_router",
    "test_case_id":  "TC-REQ-007",
    "approval_state":  "approved",
    "approved_by":  "SME+Legal Wave2",
    "approved_at":  "2026-02-20T00:00:00Z",
    "version":  "0.1.0",
    "notes":  "Promoted to approved after recorded SME and legal sign-off on 2026-02-20 (Wave 2)."
}
